LEDE,LEPU6,Lepidium pubecarpum A. Nelson,,Brassicaceae,Oklahoma
LEDE,LERA6,Lepidium ramosum A. Nelson,,Brassicaceae,Oklahoma
LEDE,LETE7,Lepidium texanum Buckley,,Brassicaceae,Oklahoma
LEDU,,Leptochloa dubia (Kunth) Nees,Green sprangletop,Poaceae,Oklahoma
LEDU,CHDU2,Chloris dubia Kunth,,Poaceae,Oklahoma
LEDU,DIDU,Diplachne dubia (Kunth) Scribn.,,Poaceae,Oklahoma
LEERS,,Leersia Sw.,cutgrass,Poaceae,Oklahoma
LEFE,,Lesquerella fendleri (A. Gray) S. Watson,Fendler's bladderpod,Brassicaceae,Oklahoma
LEFE,LEFO4,Lesquerella foliacea Greene,,Brassicaceae,Oklahoma
LEFE,LEPR6,Lesquerella praecox Wooton & Standl.,,Brassicaceae,Oklahoma
LEFR5,,Lespedeza frutescens (L.) Hornem.,shrubby lespedeza,Fabaceae,Oklahoma
LEFR5,LEIN30,"Lespedeza intermedia (S. Watson) Britton, nom. inq.",,Fabaceae,Oklahoma
LEFR5,LEVI23,Lespedeza violacea auct. non (L.) Pers.,,Fabaceae,Oklahoma
LEFU21,,Leptochloa fusca (L.) Kunth,Malabar sprangletop,Poaceae,Oklahoma
LEFU21,DIFU7,Diplachne fusca (L.) P. Beauv. ex Roem. & Schult.,,Poaceae,Oklahoma
LEFUF,,Leptochloa fusca (L.) Kunth ssp. fascicularis (Lam.) N. Snow,bearded sprangletop,Poaceae,Oklahoma
LEFUF,DIAC3,Diplachne acuminata Nash,,Poaceae,Oklahoma
LEFUF,DIFA4,Diplachne fascicularis (Lam.) P. Beauv.,,Poaceae,Oklahoma
LEFUF,DIMA10,Diplachne maritima E.P. Bicknell,,Poaceae,Oklahoma
LEFUF,LEAC2,Leptochloa acuminata (Nash) Mohlenbr.,,Poaceae,Oklahoma
LEFUF,LEFA,Leptochloa fascicularis (Lam.) A. Gray,,Poaceae,Oklahoma
LEFUF,LEFAA,Leptochloa fascicularis (Lam.) A. Gray var. acuminata (Nash) Gleason,,Poaceae,Oklahoma
LEFUF,LEFAM,Leptochloa fascicularis (Lam.) A. Gray var. maritima (E.P. Bicknell) Gleason,,Poaceae,Oklahoma
LEFUF,LEFUF2,Leptochloa fusca (L.) Kunth var. fascicularis (Lam.) Dorn,,Poaceae,Oklahoma
LEFUU,,Leptochloa fusca (L.) Kunth ssp. uninervia (J. Presl) N. Snow,Mexican sprangletop,Poaceae,Oklahoma
LEFUU,DIUN5,Diplachne uninervia (J. Presl) Parodi,,Poaceae,Oklahoma
LEFUU,LEUN2,Leptochloa uninervia (J. Presl) Hitchc. & Chase,,Poaceae,Oklahoma
LEFUU,MEUN4,Megastachya uninervia J. Presl,,Poaceae,Oklahoma
LEGI,,Lemna gibba L.,swollen duckweed,Lemnaceae,Oklahoma
LEGO,,Lesquerella gordonii (A. Gray) S. Watson,GORDON BLADDERPOD,Brassicaceae,Oklahoma
LEGOG,,Lesquerella gordonii (A. Gray) S. Watson var. gordonii,Gordon's bladderpod,Brassicaceae,Oklahoma
LEGR2,,Lesquerella gracilis (Hook.) S. Watson,LAX BLADDERPOD,Brassicaceae,Oklahoma
LEGR2,PHGR6,Physaria gracilis (Hook.) O'Kane & Al-Shehbaz,,Brassicaceae,Oklahoma
LEGRG,,Lesquerella gracilis (Hook.) S. Watson ssp. gracilis,spreading bladderpod,Brassicaceae,Oklahoma
LEGRG,VEGR4,Vesicaria gracilis Hook.,,Brassicaceae,Oklahoma
LEGRN,,Lesquerella gracilis (Hook.) S. Watson ssp. nuttallii (Torr. & A. Gray) Rollins & Shaw,Nuttall's bladderpod,Brassicaceae,Oklahoma
LEGRN,LEGRR,Lesquerella gracilis (Hook.) S. Watson var. repanda (Nutt.) Payson,,Brassicaceae,Oklahoma
LEGRN,LENU4,Lesquerella nuttallii (Torr. & A. Gray) S. Watson,,Brassicaceae,Oklahoma
LEGRN,LERE9,Lesquerella repanda (Nutt.) S. Watson,,Brassicaceae,Oklahoma
LEHI2,,Lespedeza hirta (L.) Hornem.,HAIRY LESPEDEZA,Fabaceae,Oklahoma
LEHIH2,,Lespedeza hirta (L.) Hornem. ssp. hirta,hairy lespedeza,Fabaceae,Oklahoma
LEHIH2,LECAC3,Lespedeza capitata Michx. var. calycina (Schindl.) Fernald,,Fabaceae,Oklahoma
LEHIH2,LEHIS,Lespedeza hirta (L.) Hornem. var. sparsiflora Torr. & A. Gray,,Fabaceae,Oklahoma
LEHIH2,LEPO3,Lespedeza polystachya Michx.,,Fabaceae,Oklahoma
LELE2,,Leersia lenticularis Michx.,catchfly grass,Poaceae,Oklahoma
LELE2,HOLE5,Homalocenchrus lenticularis (Michx.) Kuntze,,Poaceae,Oklahoma
LELU,,Lesquerella ludoviciana (Nutt.) S. Watson,foothill bladderpod,Brassicaceae,Oklahoma
LEMI3,,Lemna minor L.,COMMON DUCKWEED,Lemnaceae,Oklahoma
LEMI3,LECY4,Lemna cyclostasa Elliott ex Schleid.,,Lemnaceae,Oklahoma
LEMI3,LEMI2,Lemna minima Chevall. ex Schleid.,,Lemnaceae,Oklahoma
LEMI6,,Lemna minuta Kunth,least duckweed,Lemnaceae,Oklahoma
LEMI6,LEMI10,"Lemna minima Phil., non Thuill. ex P. Beauv.",,Lemnaceae,Oklahoma
LEMI6,LEMI9,Lemna minuscula Herter,,Lemnaceae,Oklahoma
LEMI6,LEVAA,Lemna valdiviana Phil. var. abbreviata Hegelm.,,Lemnaceae,Oklahoma
LEMI6,LEVAM,Lemna valdiviana Phil. var. minima (Phil.) Hegelm.,,Lemnaceae,Oklahoma
LEMNA,,Lemna L.,duckweed,Lemnaceae,Oklahoma
LEMU,,Leucospora multifida (Michx.) Nutt.,narrowleaf paleseed,Scrophulariaceae,Oklahoma
LEMU,COMU4,Conobea multifida (Michx.) Benth.,,Scrophulariaceae,Oklahoma
LEMU3,,Lechea mucronata Raf.,HAIRY PINWEED,Cistaceae,Oklahoma
LEMU3,LEMIV,Lechea minor L. var. villosa (Elliott) B. Boivin,,Cistaceae,Oklahoma
LEMU3,LEVI,Lechea villosa Elliott,,Cistaceae,Oklahoma
LEMU3,LEVIM3,Lechea villosa Elliott var. macrotheca Hodgdon,,Cistaceae,Oklahoma
LEMU3,LEVIS2,Lechea villosa Elliott var. schaffneri Hodgdon,,Cistaceae,Oklahoma
LENE8,,Lespedeza ×neglecta Mack. & Bush (pro sp.) [stuevei × virginica],lespedeza,Fabaceae,Oklahoma
LENE8,LESTA,"Lespedeza stuevei Nutt. var. angustifolia Britton, non Pursh",,Fabaceae,Oklahoma
LENU,,Lespedeza ×nuttallii Darl. (pro sp.) [hirta × violacea],lespedeza,Fabaceae,Oklahoma
LEOB,,Lepidium oblongum Small,VEINY PEPPERWEED,Brassicaceae,Oklahoma
LEOB2,,Lemna obscura (Austin) Daubs,little duckweed,Lemnaceae,Oklahoma
LEOB2,LEMIO,Lemna minor L. var. obscura Austin,,Lemnaceae,Oklahoma
LEOBO,,Lepidium oblongum Small var. oblongum,veiny pepperweed,Brassicaceae,Oklahoma
LEOBO,LEBI3,Lepidium bipinnatifidum auct. non Desv.,,Brassicaceae,Oklahoma
LEONU,,Leonurus L.,motherwort,Lamiaceae,Oklahoma
LEOR,,Leersia oryzoides (L.) Sw.,RICE CUTGRASS,Poaceae,Oklahoma
LEOR,HOOR3,Homalocenchrus oryzoides (L.) Pollich,,Poaceae,Oklahoma
LEOR,PHOR5,Phalaris oryzoides L.,,Poaceae,Oklahoma
LEOV,,Lesquerella ovalifolia Rydb. ex Britton,OVALLEAF BLADDERPOD,Brassicaceae,Oklahoma
LEOVA,,Lesquerella ovalifolia Rydb. ex Britton ssp. alba (Goodman) Rollins & Shaw,roundleaf bladderpod,Brassicaceae,Oklahoma
LEOVA,LEENA,Lesquerella engelmannii (A. Gray) S. Watson ssp. alba (Goodman) C. Clark,,Brassicaceae,Oklahoma
LEOVA,LEOVA2,Lesquerella ovalifolia Rydb. ex Britton var. alba Goodman,,Brassicaceae,Oklahoma
LEOVO,,Lesquerella ovalifolia Rydb. ex Britton ssp. ovalifolia,roundleaf bladderpod,Brassicaceae,Oklahoma
LEOVO,LEENO,Lesquerella engelmannii (A. Gray) S. Watson ssp. ovalifolia (Rydb. ex Britton) C. Clark,,Brassicaceae,Oklahoma
LEPA6,,Leptochloa panicea (Retz.) Ohwi,mucronate sprangletop,Poaceae,Oklahoma
LEPA6,DIPA26,Dinebra panicea (Retz.) P.M. Peterson & N. Snow,,Poaceae,Oklahoma
LEPAB,,Leptochloa panicea (Retz.) Ohwi ssp. brachiata (Steud.) N. Snow,mucronate sprangeltop,Poaceae,Oklahoma
LEPAB,FEFI2,Festuca filiformis Lam.,,Poaceae,Oklahoma
LEPAB,LEBR17,Leptochloa brachiata Steud.,,Poaceae,Oklahoma
LEPAB,LEFI,Leptochloa filiformis (Lam.) P. Beauv.,,Poaceae,Oklahoma
LEPAB,LEFIP,Leptochloa filiformis (Lam.) P. Beauv. var. pulchella (Scribn.) Beetle,,Poaceae,Oklahoma
LEPAM,,Leptochloa panicea (Retz.) Ohwi ssp. mucronata (Michx.) Nowack,mucronate sprangletop,Poaceae,Oklahoma
LEPAM,LEAT,Leptochloa attenuata (Nutt.) Steud.,,Poaceae,Oklahoma
LEPAM,LEFIA,Leptochloa filiformis (Lam.) P. Beauv. var. attenuata (Nutt.) Steyerm. & Kucera,,Poaceae,Oklahoma
LEPAM,LEMU10,Leptochloa mucronata (Michx.) Kunth,,Poaceae,Oklahoma
LEPE,,Lemna perpusilla Torr.,MINUTE DUCKWEED,Lemnaceae,Oklahoma
LEPE,LEPET,Lemna perpusilla Torr. var. trinervis Austin,,Lemnaceae,Oklahoma
LEPE2,,Lepidium perfoliatum L.,CLASPING PEPPERWEED,Brassicaceae,Oklahoma
LEPID,,Lepidium L.,pepperweed,Brassicaceae,Oklahoma
LEPR,,Lespedeza procumbens Michx.,TRAILING LESPEDEZA,Fabaceae,Oklahoma
LEPTO,,Leptochloa P. Beauv.,sprangletop,Poaceae,Oklahoma
LEPUR,,Lepuropetalon Elliott,lepuropetalon,Saxifragaceae,Oklahoma
LERE2,,Lespedeza repens (L.) W.P.C. Barton,CREEPING LESPEDEZA,Fabaceae,Oklahoma
LERE2,HERE7,Hedysarum repens L.,,Fabaceae,Oklahoma
LESI,,Leonurus sibiricus L.,honeyweed,Lamiaceae,Oklahoma
LESI,LEAR7,Leonurus artemisia auct. non Lour.,,Lamiaceae,Oklahoma
LESI2,,Lespedeza ×simulata Mack. & Bush (pro sp.) [capitata × virginica],lespedeza,Fabaceae,Oklahoma
LESP,,Lepuropetalon spathulatum Elliott,petiteplant,Saxifragaceae,Oklahoma
LESP,PYSP2,"Pyxidanthera spathulata Muhl., nom. nud.",,Saxifragaceae,Oklahoma
LESPE,,Lespedeza Michx.,PERENNIAL LESPEDEZA,Fabaceae,Oklahoma
LESQU,,Lesquerella S. Watson,Bladderpod,Brassicaceae,Oklahoma
LEST5,,Lespedeza stuevei Nutt.,STUVES LESPEDEZA,Fabaceae,Oklahoma
LETE,,Lechea tenuifolia Michx.,NARROWLEAF PINWEED,Cistaceae,Oklahoma
LETE,LETEO,Lechea tenuifolia Michx. var. occidentalis Hodgdon,,Cistaceae,Oklahoma
LETU2,,Lemna turionifera Landolt,turion duckweed,Lemnaceae,Oklahoma
LEUCA4,,Leucanthemum Mill.,daisy,Asteraceae,Oklahoma
LEUCO4,,Leucospora Nutt.,leucospora,Scrophulariaceae,Oklahoma
LEVA,,Lemna valdiviana Phil.,VALDIVIA DUCKWEED,Lemnaceae,Oklahoma
LEVA,LECY5,Lemna cyclostasa (Elliott) C.H. Thomp.,,Lemnaceae,Oklahoma
LEVA,LETO3,Lemna torreyi Austin,,Lemnaceae,Oklahoma
LEVI2,,Leersia virginica Willd.,WHITEGRASS,Poaceae,Oklahoma
LEVI2,HOVI4,Homalocenchrus virginicus (Willd.) Britton,,Poaceae,Oklahoma
LEVI2,LEVIO,Leersia virginica Willd. var. ovata (Poir.) Fernald,,Poaceae,Oklahoma
LEVI3,,Lepidium virginicum L.,VIRGINIA PEPPERWEED,Brassicaceae,Oklahoma
LEVI6,,Lespedeza violacea (L.) Pers.,Violet lespedeza,Fabaceae,Oklahoma
LEVI6,HEVI7,Hedysarum violaceum L.,,Fabaceae,Oklahoma
LEVI6,LEIN2,"Lespedeza intermedia sensu Clewell, 1966",,Fabaceae,Oklahoma
LEVI6,LEPR5,Lespedeza prairea (Mack. & Bush) Britton,,Fabaceae,Oklahoma
LEVI7,,Lespedeza virginica (L.) Britton,Slender lespedeza,Fabaceae,Oklahoma
LEVIM,,Lepidium virginicum L. var. medium (Greene) C.L. Hitchc.,intermediate pepperweed,Brassicaceae,Oklahoma
LEVIM,LEID,Lepidium idahoense A. Heller,,Brassicaceae,Oklahoma
LEVIM,LEME3,Lepidium medium Greene,,Brassicaceae,Oklahoma
LEVIV2,,Lepidium virginicum L. var. virginicum,Virginia pepperweed,Brassicaceae,Oklahoma
LEVIV2,LEVIT,Lepidium virginicum L. var. typicum C.L. Hitchc.,,Brassicaceae,Oklahoma
LEVU,,Leucanthemum vulgare Lam.,oxeye daisy,Asteraceae,Oklahoma
LEVU,CHLE80,Chrysanthemum leucanthemum L.,,Asteraceae,Oklahoma
LEVU,CHLEB,Chrysanthemum leucanthemum L. var. boecheri B. Boivin,,Asteraceae,Oklahoma
LEVU,CHLEP,Chrysanthemum leucanthemum L. var. pinnatifidum Lecoq & Lamotte,,Asteraceae,Oklahoma
LEVU,LELE12,"Leucanthemum leucanthemum (L.) Rydb., nom. inval.",,Asteraceae,Oklahoma
LEVU,LEVUP,Leucanthemum vulgare Lam. var. pinnatifidum (Lecoq & Lamotte) Moldenke,,Asteraceae,Oklahoma
LIAE3,,Liatris aestivalis G.L. Nesom & R. O'Kennon,blazing star,Asteraceae,Oklahoma
LIAR,,Limnodea arkansana (Nutt.) L.H. Dewey,OZARKGRASS,Poaceae,Oklahoma
LIAR,CIAR10,Cinna arkansana (Nutt.) G. Tucker,,Poaceae,Oklahoma
LIAR6,,Lipocarpha aristulata (Coville) G. Tucker,awned halfchaff sedge,Cyperaceae,Oklahoma
LIAR6,HEAR7,Hemicarpha aristulata (Coville) Smyth,,Cyperaceae,Oklahoma
LIAR6,HEMIA2,Hemicarpha micrantha (Vahl) Pax var. aristulata Coville,,Cyperaceae,Oklahoma
LIAR6,LIMI4,Lipocarpha microcephala auct. non Kunth,,Cyperaceae,Oklahoma
LIAS,,Liatris aspera Michx.,Tall gayfeather,Asteraceae,Oklahoma
LIASA,,Liatris aspera Michx. var. aspera,tall blazing star,Asteraceae,Oklahoma
LIASA,LAAS2,Lacinaria aspera (Michx.) Greene,,Asteraceae,Oklahoma
LIASI,,Liatris aspera Michx. var. intermedia (Lunell) Gaiser,tall blazing star,Asteraceae,Oklahoma
LIASI,LASQI,Lacinaria squarrosa (L.) Hill var. intermedia (Lunell) DC.,,Asteraceae,Oklahoma
LIATR,,Liatris Gaertn. ex Schreb.,Gayfeather,Asteraceae,Oklahoma
LIAU3,,Listera australis Lindl.,southern twayblade,Orchidaceae,Oklahoma
LIAU3,NEAU2,Neottia australis (Lindl.) Szlach.,,Orchidaceae,Oklahoma
LIAU3,NEBI3,Neottia bifolia (Raf.) Baumbach,,Orchidaceae,Oklahoma
LIAU3,OPAU6,Ophrys australis (Lindl.) House,,Orchidaceae,Oklahoma
LIBE2,,Linum berlandieri Hook.,Berlandier's yellow flax,Linaceae,Oklahoma
LIBE3,,Lindera benzoin (L.) Blume,SPICEBUSH,Lauraceae,Oklahoma
LIBEB,,Lindera benzoin (L.) Blume var. benzoin,northern spicebush,Lauraceae,Oklahoma
LIBEB,BEAE,Benzoin aestivale (L.) Nees,,Lauraceae,Oklahoma
LIBEB2,,Linum berlandieri Hook. var. berlandieri,Berlandier's yellow flax,Linaceae,Oklahoma
LIBEB2,CABE10,Cathartolinum berlandieri (Hook.) Small,,Linaceae,Oklahoma
LIBEB2,CASA16,Cathartolinum sanctum (Small) Small,,Linaceae,Oklahoma
LIBEB2,LIRIB,Linum rigidum Pursh var. berlandieri (Hook.) Torr. & A. Gray,,Linaceae,Oklahoma
LIBEB2,LISA4,Linum sanctum Small,,Linaceae,Oklahoma
LIBEP,,Lindera benzoin (L.) Blume var. pubescens (Palmer & Steyerm.) Rehder,northern spicebush,Lauraceae,Oklahoma
LIBEP,BEAEP,Benzoin aestivale (L.) Nees var. pubescens Palmer & Steyerm.,,Lauraceae,Oklahoma
LICA12,,Lithospermum canescens (Michx.) Lehm.,HOARY GROMWELL,Boraginaceae,Oklahoma
LICA12,BACA7,Batschia canescens Michx.,,Boraginaceae,Oklahoma
LICA13,,Lithospermum caroliniense (Walter ex J.F. Gmel.) MacMill.,CAROLINA GROMWELL,Boraginaceae,Oklahoma
LICAC8,,Lithospermum caroliniense (Walter ex J.F. Gmel.) MacMill. var. caroliniense,Carolina puccoon,Boraginaceae,Oklahoma
LICAC8,BACA5,Batschia caroliniensis Walter ex J.F. Gmel.,,Boraginaceae,Oklahoma
LICAC8,LICA27,Lithospermum carolinianum Lam.,,Boraginaceae,Oklahoma
LICAC8,LIGM,Lithospermum gmelini (Michx.) Hitchc.,,Boraginaceae,Oklahoma
LICAC9,,Lithospermum caroliniense (Walter ex J.F. Gmel.) MacMill. var. croceum (Fernald) Cronquist,Carolina puccoon,Boraginaceae,Oklahoma
LICAC9,LICAC7,Lithospermum caroliniense (Walter ex J.F. Gmel.) MacMill. ssp. croceum (Fernald) Cusick,,Boraginaceae,Oklahoma
LICAC9,LICR4,Lithospermum croceum Fernald,,Boraginaceae,Oklahoma
LICO3,,Linum compactum A. Nelson,Wyoming flax,Linaceae,Oklahoma
LICO3,CACO46,Cathartolinum compactum (A. Nelson) Small,,Linaceae,Oklahoma
LICO3,LIRIC,Linum rigidum Pursh var. compactum (A. Nelson) C.M. Rogers,,Linaceae,Oklahoma
LIDA,,Linaria dalmatica (L.) Mill.,Dalmatian toadflax,Scrophulariaceae,Oklahoma
LIDAD,,Linaria dalmatica (L.) Mill. ssp. dalmatica,Dalmatian toadflax,Scrophulariaceae,Oklahoma
LIDAD,LIGED,Linaria genistifolia (L.) Mill. ssp. dalmatica (L.) Maire & Petitm.,,Scrophulariaceae,Oklahoma
LIDAD,LIJA3,Linaria jattae Palanza,,Scrophulariaceae,Oklahoma
LIDE4,,Liatris densispicata (Bush) Gaiser,densespike blazing star,Asteraceae,Oklahoma
LIDEI,,Liatris densispicata (Bush) Gaiser var. interrupta Gaiser,densespike blazing star,Asteraceae,Oklahoma
LIDEI,LIAN4,Liatris angustifolia (Bush) Gaiser,,Asteraceae,Oklahoma
LIDR3,,Lipocarpha drummondii (Nees) G. Tucker,Drummond's halfchaff sedge,Cyperaceae,Oklahoma
LIDR3,HEDR3,Hemicarpha drummondii Nees,,Cyperaceae,Oklahoma
LIDR3,HEMID3,Hemicarpha micrantha (Vahl) Pax var. drummondii (Nees) Friedland,,Cyperaceae,Oklahoma
LIDR3,SCMID,Scirpus micranthus Vahl var. drummondii (Nees) Mohlenbr.,,Cyperaceae,Oklahoma
LIDU,,Lindernia dubia (L.) Pennell,MOISTBANK PIMPERNEL,Scrophulariaceae,Oklahoma
LIDUA,,Lindernia dubia (L.) Pennell var. anagallidea (Michx.) Cooperr.,FALSE PIMPERNEL,Scrophulariaceae,Oklahoma
LIDUA,ILAN3,Ilysanthes anagallidea (Michx.) B.L. Rob.,,Scrophulariaceae,Oklahoma
LIDUA,ILIN,Ilysanthes inequalis (Walter) Pennell,,Scrophulariaceae,Oklahoma
LIDUA,LIAN2,Lindernia anagallidea (Michx.) Pennell,,Scrophulariaceae,Oklahoma
LIDUD,,Lindernia dubia (L.) Pennell var. dubia,yellowseed false pimpernel,Scrophulariaceae,Oklahoma
LIDUD,GRDU,Gratiola dubia L.,,Scrophulariaceae,Oklahoma
LIDUD,ILAT3,Ilysanthes attenuata (Spreng.) Small,,Scrophulariaceae,Oklahoma
LIDUD,ILDU,Ilysanthes dubia (L.) Barnhart,,Scrophulariaceae,Oklahoma
LIDUD,LIDUI,Lindernia dubia (L.) Pennell var. inundata (Pennell) Pennell,,Scrophulariaceae,Oklahoma
LIDUD,LIDUM,Lindernia dubia (L.) Pennell var. major (Pursh) Pennell,,Scrophulariaceae,Oklahoma
LIDUD,LIDUR,Lindernia dubia (L.) Pennell var. riparia (Raf.) Fernald,,Scrophulariaceae,Oklahoma
LIDUD,LIDUT,Lindernia dubia (L.) Pennell var. typica Pennell,,Scrophulariaceae,Oklahoma
LIDUD,LIPR2,Lindernia procumbens auct. non (Knock.) Borb.,,Scrophulariaceae,Oklahoma
LIDUD,LIPY3,"Lindernia pyxidaria sensu Pennell, non L.",,Scrophulariaceae,Oklahoma
LIEL,,Liatris elegans (Walter) Michx.,PINKSCALE GAYFEATHER,Asteraceae,Oklahoma
LIELE,,Liatris elegans (Walter) Michx. var. elegans,pinkscale blazing star,Asteraceae,Oklahoma
LIELE,LAEL,Lacinaria elegans (Walter) Kuntze,,Asteraceae,Oklahoma
LIELE,LAFL4,Lacinaria flabellata Small,,Asteraceae,Oklahoma
LIELE,LIELF,Liatris elegans (Walter) Michx. var. flabellata (Small) Gaiser,,Asteraceae,Oklahoma
LIGUS2,,Ligustrum L.,privet,Oleaceae,Oklahoma
LIHU2,,Linum hudsonioides Planch.,Texas flax,Linaceae,Oklahoma
LIHU2,CECL,Cerastium clawsonii Correll,,Linaceae,Oklahoma
LIHU2,MEHU4,Mesynium hudsonioides (Planch.) W.A. Weber,,Linaceae,Oklahoma
LIIM,,Linum imbricatum (Raf.) Shinners,TOOTHED FLAX,Linaceae,Oklahoma
LIIM,CAMU17,Cathartolinum multicaule (Hook.) Small,,Linaceae,Oklahoma
LIIM,MEIM2,Mesynium imbricatum (Raf.) W.A. Weber,,Linaceae,Oklahoma
LIIM,NEIM,Nezera imbricata Raf.,,Linaceae,Oklahoma
LIIN2,,Lithospermum incisum Lehm.,Fringed puccoon,Boraginaceae,Oklahoma
LIIN2,BALI,Batschia linearifolia (Goldie) Small,,Boraginaceae,Oklahoma
LIIN2,LIAN6,Lithospermum angustifolium Michx.,,Boraginaceae,Oklahoma
LIIN2,LILI8,Lithospermum linearifolium Goldie,,Boraginaceae,Oklahoma
LIIN2,LIMA14,Lithospermum mandanense Spreng.,,Boraginaceae,Oklahoma
LILE3,,Linum lewisii Pursh,LEWIS FLAX,Linaceae,Oklahoma
LILEL2,,Linum lewisii Pursh var. lewisii,prairie flax,Linaceae,Oklahoma
LILEL2,ADLE,Adenolinum lewisii (Pursh) Á. Löve & D. Löve,,Linaceae,Oklahoma
LILEL2,LIPEL3,Linum perenne L. ssp. lewisii (Pursh) Hultén,,Linaceae,Oklahoma
LILEL2,LIPEL2,Linum perenne L. var. lewisii (Pursh) Eaton & J. Wright,,Linaceae,Oklahoma
LILI3,,Liparis liliifolia (L.) Rich. ex Ker Gawl.,brown widelip orchid,Orchidaceae,Oklahoma
LILI4,,Limonium limbatum Small,SEA LAVENDER,Plumbaginaceae,Oklahoma
LILI4,LILIG,Limonium limbatum Small var. glabrescens Correll,,Plumbaginaceae,Oklahoma
LILIU,,Lilium L.,lily,Liliaceae,Oklahoma
LIME2,,Linum medium (Planch.) Britton,stiff yellow flax,Linaceae,Oklahoma
LIMET,,Linum medium (Planch.) Britton var. texanum (Planch.) Fernald,SUCKER FLAS,Linaceae,Oklahoma
LIMET,CACU12,Cathartolinum curtissii (Small) Small,,Linaceae,Oklahoma
LIMET,LISTT,Linum striatum Walter var. texanum (Planch.) B. Boivin,,Linaceae,Oklahoma
LIMET,LIVIT,Linum virginianum L. var. texanum Planch.,,Linaceae,Oklahoma
LIMI12,,Lipocarpha micrantha (Vahl) G. Tucker,smallflower halfchaff sedge,Cyperaceae,Oklahoma
LIMI12,HEMI5,Hemicarpha micrantha (Vahl) Pax,,Cyperaceae,Oklahoma
LIMI12,HEMIM3,Hemicarpha micrantha (Vahl) Pax var. minor (Schrad.) Friedland,,Cyperaceae,Oklahoma
LIMI12,SCMI11,Scirpus micranthus Vahl,,Cyperaceae,Oklahoma
LIMI12,SCMIM2,Scirpus micranthus Vahl var. minor (Schrad. ex Roem. & Schult.) B. Boivin,,Cyperaceae,Oklahoma
LIMI9,,Lilium michiganense Farw.,Michigan lily,Liliaceae,Oklahoma
LIMI9,LICAM,Lilium canadense L. ssp. michiganense (Farw.) B. Boivin & Cody,,Liliaceae,Oklahoma
LIMI9,LICAU,Lilium canadense L. var. umbelliferum (Farw.) B. Boivin,,Liliaceae,Oklahoma
LIMI9,LIMIU,Lilium michiganense Farw. var. uniflorum Farw.,,Liliaceae,Oklahoma
LIMNO,,Limnobium Rich.,spongeplant,Hydrocharitaceae,Oklahoma
LIMNO2,,Limnodea L.H. Dewey,Ozark grass,Poaceae,Oklahoma
LIMNO3,,Limnosciadium Mathias & Constance,dogshade,Apiaceae,Oklahoma
LIMON,,Limonium Mill.,sea lavender,Plumbaginaceae,Oklahoma
LIMU3,,Lithospermum multiflorum Torr. ex A. Gray,manyflowered stoneseed,Boraginaceae,Oklahoma
LINAR,,Linaria Mill.,toadflax,Scrophulariaceae,Oklahoma
LINDE,,Lindernia All.,false pimpernel,Scrophulariaceae,Oklahoma
LINDE2,,Lindera Thunb.,spicebush,Lauraceae,Oklahoma
LINDH,,Lindheimera A. Gray & Engelm.,lindheimera,Asteraceae,Oklahoma
LINUM,,Linum L.,flax,Linaceae,Oklahoma
LIPAR,,Liparis Rich.,widelip orchid,Orchidaceae,Oklahoma
LIPI2,,Limnosciadium pinnatum (DC.) Mathias & Constance,tansy dogshade,Apiaceae,Oklahoma
LIPI2,CYPI6,Cynosciadium pinnatum DC.,,Apiaceae,Oklahoma
LIPOC,,Lipocarpha R. Br.,halfchaff sedge,Cyperaceae,Oklahoma
LIPR,,Linum pratense (Norton) Small,MEADOW FLAX,Linaceae,Oklahoma
LIPR,ADPR,Adenolinum pratense (Norton) W.A. Weber,,Linaceae,Oklahoma
LIPR,LILEP,Linum lewisii Pursh var. pratense Norton,,Linaceae,Oklahoma
LIPU,,Liatris punctata Hook.,Dotted gayfeather,Asteraceae,Oklahoma
LIPUM2,,Liatris punctata Hook. var. mucronata (DC.) B.L. Turner,cusp blazing star,Asteraceae,Oklahoma
LIPUM2,LIMU,Liatris mucronata DC.,,Asteraceae,Oklahoma
LIPUP,,Liatris punctata Hook. var. punctata,dotted blazing star,Asteraceae,Oklahoma
LIPUP,LAPU8,Lacinaria punctata (Hook.) Kuntze,,Asteraceae,Oklahoma
LIPUP,LIPUN,Liatris punctata Hook. var. nebraskana Gaiser,,Asteraceae,Oklahoma
LIPUP,LIPUT,Liatris punctata Hook. var. typica Gaiser,,Asteraceae,Oklahoma
LIPY,,Liatris pycnostachya Michx.,KANSAS GAYFEATHER,Asteraceae,Oklahoma
LIPYP,,Liatris pycnostachya Michx. var. pycnostachya,prairie blazing star,Asteraceae,Oklahoma
LIPYP,LAPY,Lacinaria pycnostachya (Michx.) Kuntze,,Asteraceae,Oklahoma
LIPYP,LIBE5,Liatris bebbiana Rydb.,,Asteraceae,Oklahoma
LIQUI,,Liquidambar L.,sweetgum,Hamamelidaceae,Oklahoma
LIRI,,Linum rigidum Pursh,Stiff flax,Linaceae,Oklahoma
LIRIR,,Linum rigidum Pursh var. rigidum,stiffstem flax,Linaceae,Oklahoma
LIRIR,CAEA3,Cathartolinum earlei Small,,Linaceae,Oklahoma
LIRIR,CARI10,Cathartolinum rigidum (Pursh) Small,,Linaceae,Oklahoma
LIRIR,MERI2,Mesynium rigidum (Pursh) Á. Löve & D. Löve,,Linaceae,Oklahoma
LISI,,Ligustrum sinense Lour.,COMMON CHINESE PRIVET,Oleaceae,Oklahoma
LISI,LIMI13,Ligustrum microcarpum Kaneh. & Sasaki,,Oleaceae,Oklahoma
LISI,LIVI7,Ligustrum villosum May,,Oleaceae,Oklahoma
LISP2,,Limnobium spongia (Bosc) Rich. ex Steud.,FROGBITE,Hydrocharitaceae,Oklahoma
LISP2,HYCO12,Hydrocharis cordifolia Nutt.,,Hydrocharitaceae,Oklahoma
LISP2,HYSP6,Hydrocharis spongia Bosc,,Hydrocharitaceae,Oklahoma
LISQ,,Liatris squarrosa (L.) Michx.,scaly blazing star,Asteraceae,Oklahoma
LISQ2,,Liatris squarrulosa Michx.,TALL GAYFEATHER,Asteraceae,Oklahoma
LISQ2,LARU2,Lacinaria ruthii Alexander,,Asteraceae,Oklahoma
LISQ2,LASH,Lacinaria shortii Alexander,,Asteraceae,Oklahoma
LISQ2,LATR7,Lacinaria tracyi Alexander,,Asteraceae,Oklahoma
LISQ2,LIEA,Liatris earlei (Greene) K. Schum.,,Asteraceae,Oklahoma
LISQ2,LISC,Liatris scabra (Greene) K. Schum.,,Asteraceae,Oklahoma
LISQ2,LISCS,Liatris scariosa (L.) Willd. var. squarrulosa (Michx.) A. Gray,,Asteraceae,Oklahoma
LISQG,,Liatris squarrosa (L.) Michx. var. glabrata (Rydb.) Gaiser,scaly blazing star,Asteraceae,Oklahoma
LISQG,LIGL4,Liatris glabrata Rydb.,,Asteraceae,Oklahoma
LISQH,,Liatris squarrosa (L.) Michx. var. hirsuta (Rydb.) Gaiser,scaly blazing star,Asteraceae,Oklahoma
LISQH,LIHI2,Liatris hirsuta Rydb.,,Asteraceae,Oklahoma
LIST,,Linum striatum Walter,RIGID FLAX,Linaceae,Oklahoma
LIST,CAST31,Cathartolinum striatum (Walter) Small,,Linaceae,Oklahoma
LIST,LISTM2,Linum striatum Walter var. multijugum Fernald,,Linaceae,Oklahoma
LIST,NEST3,Nezera striata (Walter) Nieuwl.,,Linaceae,Oklahoma
LIST2,,Liquidambar styraciflua L.,SWEETGUM,Hamamelidaceae,Oklahoma
LISTE,,Listera R. Br.,twayblade,Orchidaceae,Oklahoma
LISU4,,Linum sulcatum Riddell,GROOVED FLAX,Linaceae,Oklahoma
LISUS,,Linum sulcatum Riddell var. sulcatum,grooved flax,Linaceae,Oklahoma
LISUS,CASU28,Cathartolinum sulcatum (Riddell) Small,,Linaceae,Oklahoma
LISUS,MESU8,Mesynium sulcatum (Riddell) Á. Löve & D. Löve,,Linaceae,Oklahoma
LITE3,,Lindheimera texana A. Gray & Engelm.,TEXAS STAR,Asteraceae,Oklahoma
LITHO3,,Lithospermum L.,stoneseed,Boraginaceae,Oklahoma
LIUS,,Linum usitatissimum L.,common flax,Linaceae,Oklahoma
LIUS,LIHU3,Linum humile Mill.,,Linaceae,Oklahoma
LIUS,LIUSH,Linum usitatissimum L. var. humile (Mill.) Pers.,,Linaceae,Oklahoma
LIVU2,,Linaria vulgaris Mill.,BUTTER AND EGGS,Scrophulariaceae,Oklahoma
LIVU2,LILI6,"Linaria linaria (L.) Karst., nom. inval.",,Scrophulariaceae,Oklahoma
LOAL,,Lonicera albiflora Torr. & A. Gray,WESTERN WHITE HONEYSUCKLE,Caprifoliaceae,Oklahoma
LOAL,LOALD,Lonicera albiflora Torr. & A. Gray var. dumosa (A. Gray) Rehder,,Caprifoliaceae,Oklahoma
LOAL,LODU4,Lonicera dumosa A. Gray,,Caprifoliaceae,Oklahoma
LOAP,,Lobelia appendiculata A. DC.,EARFLOWER LOBELIA,Campanulaceae,Oklahoma
LOAPA,,Lobelia appendiculata A. DC. var. appendiculata,pale lobelia,Campanulaceae,Oklahoma
LOBEL,,Lobelia L.,lobelia,Campanulaceae,Oklahoma
LOCA2,,Lobelia cardinalis L.,Cardinal flower,Campanulaceae,Oklahoma
LOCA2,LOCAG2,Lobelia cardinalis L. ssp. graminea (Lam.) McVaugh,,Campanulaceae,Oklahoma
LOCA2,LOCAG5,Lobelia cardinalis L. var. graminea (Lam.) McVaugh,,Campanulaceae,Oklahoma
LOCA2,LOCAM3,Lobelia cardinalis L. var. meridionalis Bowden,,Campanulaceae,Oklahoma
LOCA2,LOCAM,Lobelia cardinalis L. var. multiflora (Paxton) McVaugh,,Campanulaceae,Oklahoma
LOCA2,LOCAP5,Lobelia cardinalis L. var. phyllostachya (Engelm.) McVaugh,,Campanulaceae,Oklahoma
LOCA2,LOCAP6,Lobelia cardinalis L. var. propinqua (Paxton) Bowden,,Campanulaceae,Oklahoma
LOCA2,LOCAP4,Lobelia cardinalis L. var. pseudosplendens McVaugh,,Campanulaceae,Oklahoma
LOCA2,LOFU,Lobelia fulgens Humb. & Bonpl. ex Willd.,,Campanulaceae,Oklahoma
LOCA2,LOSP3,Lobelia splendens Humb. & Bonpl. ex Willd.,,Campanulaceae,Oklahoma
LOCO6,,Lotus corniculatus L.,Birdsfoot trefoil,Fabaceae,Oklahoma
LOCOC5,,Lotus corniculatus L. var. corniculatus,bird's-foot trefoil,Fabaceae,Oklahoma
LOCOC5,LOCA15,Lotus caucasicus Kuprian.,,Fabaceae,Oklahoma
LOCOC5,LOCOA,Lotus corniculatus L. var. arvensis (Schkuhr) Ser. ex DC.,,Fabaceae,Oklahoma
LOCOC5,LOFI2,Lotus filicaulis Durieu,,Fabaceae,Oklahoma
LODI2,,Lonicera dioica L.,limber honeysuckle,Caprifoliaceae,Oklahoma
LODI2,LODID,Lonicera dioica L. var. dasygyna (Rehder) Gleason,,Caprifoliaceae,Oklahoma
LODI2,LODIG,Lonicera dioica L. var. glaucescens (Rydb.) Butters,,Caprifoliaceae,Oklahoma
LODI2,LODIO,Lonicera dioica L. var. orientalis Gleason,,Caprifoliaceae,Oklahoma
LODI2,LOGL6,Lonicera glaucescens (Rydb.) Rydb.,,Caprifoliaceae,Oklahoma
LODI2,LOGLD,Lonicera glaucescens (Rydb.) Rydb. var. dasygyna Rehder,,Caprifoliaceae,Oklahoma
LOEFL,,Loeflingia L.,loeflingia,Caryophyllaceae,Oklahoma
